{
  "request_id": "example-needs-input-request",
  "task_prompt": "Design a deployment workflow for my selected target, but no target was supplied.",
  "known_context": [
    {
      "kind": "subagent_discovery",
      "method": "tool_search",
      "queries": ["spawn_agent", "spawn_subagent", "subagent", "multi_agent"],
      "result": "no_host_native_lifecycle_tool_found"
    }
  ],
  "runtime_capabilities": {
    "available_tools": [],
    "durable_state": false,
    "checkpoint_resume": false,
    "sandbox": false,
    "human_interrupt": false,
    "parallel_execution": false,
    "subagents": false
  },
  "policy_constraints": {
    "allowed_side_effects": [],
    "forbidden_actions": ["deploy without an explicit target"],
    "approval_rules": []
  },
  "budget_envelope": {},
  "output_requirements": {"format": "application/json"}
}
